{
  "schema_version": 1,
  "name": "Goblin",
  "armor_class": 15,
  "max_hp": 7,
  "initiative_bonus": 2,
  "saving_throw_bonuses": {
    "str": -1,
    "dex": 2,
    "con": 0,
    "int": 0,
    "wis": -1,
    "cha": -1
  },
  "ruleset": "D&D 5e Basic Rules (2014)",
  "source_url": "https://www.dndbeyond.com/monsters/16907-goblin",
  "creature_tags": [
    "humanoid",
    "goblinoid"
  ],
  "multiattack": [],
  "unmodeled_traits": [],
  "attacks": [
    {
      "name": "Scimitar",
      "attack_bonus": 4,
      "damage_dice": "1d6",
      "damage_modifier": 2,
      "damage_type": "slashing",
      "attack_mode": "melee",
      "reach_feet": 5,
      "unmodeled_effects": []
    },
    {
      "name": "Shortbow",
      "attack_bonus": 4,
      "damage_dice": "1d6",
      "damage_modifier": 2,
      "damage_type": "piercing",
      "attack_mode": "ranged",
      "normal_range_feet": 80,
      "long_range_feet": 320,
      "unmodeled_effects": []
    }
  ],
  "nimble_escape": true,
  "stealth_bonus": 6,
  "passive_perception": 9
}
